<?xml version="1.0" encoding="utf-8"?>
<influencelistconfigurations xmlns:xsi="http://www.w3.org/2001/XMLSchema-instance" xmlns:xsd="http://www.w3.org/2001/XMLSchema" xsi:noNamespaceSchemaLocation="influenceconfigurations.xsd">
  <influencelist id="scenario_spacesuit_bomb_defused">
    <influences>
      <influence type="hullshielddamage">
        <profile type="continuous" startvalue="0.4" duration="2" />
      </influence>
      <influence type="forwardacceleration">
        <profile type="envelope" startvalue="1" sustainvalue="0" endvalue="1" attackduration="0" sustainduration="2" releaseduration="0" />
      </influence>
      <influence type="reverseacceleration">
        <profile type="envelope" startvalue="1" sustainvalue="0" endvalue="1" attackduration="0" sustainduration="2" releaseduration="0" />
      </influence>
      <influence type="strafeacceleration">
        <profile type="envelope" startvalue="1" sustainvalue="0" endvalue="1" attackduration="0" sustainduration="2" releaseduration="0" />
      </influence>
      <influence type="steeringacceleration">
        <profile type="envelope" startvalue="1" sustainvalue="0" endvalue="1" attackduration="0" sustainduration="2" releaseduration="0" />
      </influence>
    </influences>
  </influencelist>
</influencelistconfigurations>
